{"$schema":"./artifact-manifest.schema.json","artifact_type":"P1_GENERATED_ARTIFACT_SHA256_MANIFEST","artifacts":[{"path":"research/scenarios/interp-dialogue-001/elicitation/p1/session-inputs/session-input-0001.json","run_id":"P1V0-RUN-0001","sha256":"a1e8a6394fd356ddfdd91099760a74dadda6508db59d368e9288179ea55de90c"},{"path":"research/scenarios/interp-dialogue-001/elicitation/p1/runs/run-0001.json","run_id":"P1V0-RUN-0001","sha256":"0a7832ebe1966768a59d8e72ddadfde960d5618e8e59b34ab3905adbcc90f70f"},{"path":"research/scenarios/interp-dialogue-001/elicitation/p1/assessment/mechanical/mechanical-candidates-0001.json","run_id":"P1V0-RUN-0001","sha256":"21ae1c2bb0e0340d5ea396adabd5bb085bd310c9f1d9251f098d33f5447d0bef"},{"path":"research/scenarios/interp-dialogue-001/elicitation/p1/assessment/mapping/mapping-candidates-0001.json","run_id":"P1V0-RUN-0001","sha256":"c0970b9b9082d5575fc434b7588e5bb4e902dac679ab06c4e4beb3c7a8d84d42"},{"path":"research/scenarios/interp-dialogue-001/elicitation/p1/session-inputs/session-input-0002.json","run_id":"P1V0-RUN-0002","sha256":"bf32956387d825c198aec39bdc94b7d9d46efb613f6422fedc813590fe2d965a"},{"path":"research/scenarios/interp-dialogue-001/elicitation/p1/runs/run-0002.json","run_id":"P1V0-RUN-0002","sha256":"5184c1c2d620bf9632661cdc2e34d8b09b0b3ee5ba7a51531ca685eecff4c9cc"},{"path":"research/scenarios/interp-dialogue-001/elicitation/p1/assessment/mechanical/mechanical-candidates-0002.json","run_id":"P1V0-RUN-0002","sha256":"80f290fee283b19811deeacc03f2b022b2a9060cbeedd683e2f524d916d08cf6"},{"path":"research/scenarios/interp-dialogue-001/elicitation/p1/assessment/mapping/mapping-candidates-0002.json","run_id":"P1V0-RUN-0002","sha256":"47212af46e8719250a3c126614f6de38ad08e8b38498bcbfdd7c4ac9f535efdd"},{"path":"research/scenarios/interp-dialogue-001/elicitation/p1/session-inputs/session-input-0003.json","run_id":"P1V0-RUN-0003","sha256":"8d2b0fd268bba1e30a1ff7c3f51f63147afdb5d542a2de2cdb3c910e5b437e9c"},{"path":"research/scenarios/interp-dialogue-001/elicitation/p1/runs/run-0003.json","run_id":"P1V0-RUN-0003","sha256":"7595e61c5c479032d69382ea6b05460826dc14ea7540d2d60455f6d0cfccecfd"},{"path":"research/scenarios/interp-dialogue-001/elicitation/p1/assessment/mechanical/mechanical-candidates-0003.json","run_id":"P1V0-RUN-0003","sha256":"1c1e19d9ac6bd665de56185dc4e24fe0810fb0219bee358d09403401ccb20f0c"},{"path":"research/scenarios/interp-dialogue-001/elicitation/p1/assessment/mapping/mapping-candidates-0003.json","run_id":"P1V0-RUN-0003","sha256":"b5e83701a0e6f9f17b0378aeb80057b0cf0ccb4faa21d18534e22dae1bd6403f"},{"path":"research/scenarios/interp-dialogue-001/elicitation/p1/session-inputs/session-input-0004.json","run_id":"P1V0-RUN-0004","sha256":"6ebe495dccbb10a47ea6e14c08406a519177927c73841e9b8e290640c4cb575c"},{"path":"research/scenarios/interp-dialogue-001/elicitation/p1/runs/run-0004.json","run_id":"P1V0-RUN-0004","sha256":"ea222ecca55e1da1484f3176ab32abeca4b9558dba52e19067aeca18920e46ec"},{"path":"research/scenarios/interp-dialogue-001/elicitation/p1/assessment/mechanical/mechanical-candidates-0004.json","run_id":"P1V0-RUN-0004","sha256":"df0674c3000601c49745e15759a0aea8a81c235df74185f806f2682e3bdcb2d9"},{"path":"research/scenarios/interp-dialogue-001/elicitation/p1/assessment/mapping/mapping-candidates-0004.json","run_id":"P1V0-RUN-0004","sha256":"6c0501bf8ff8e3f68e83fff79555ecf6cdf2ba14e471fb556542ceb5da942f67"},{"path":"research/scenarios/interp-dialogue-001/elicitation/p1/session-inputs/session-input-0005.json","run_id":"P1V0-RUN-0005","sha256":"95f7652837e1b9061db85416557ca4d7ab2583e9c50eb6fd4a3eb9cd8b1265d2"},{"path":"research/scenarios/interp-dialogue-001/elicitation/p1/runs/run-0005.json","run_id":"P1V0-RUN-0005","sha256":"79e168c22e3a26af9e5dc6df95149c3d09ff8b1a981eff4010a507da33a706be"},{"path":"research/scenarios/interp-dialogue-001/elicitation/p1/assessment/mechanical/mechanical-candidates-0005.json","run_id":"P1V0-RUN-0005","sha256":"6c191048adda20cbb566532e1c1b83aca172b899e41d3f421291f8f14d5c3f98"},{"path":"research/scenarios/interp-dialogue-001/elicitation/p1/assessment/mapping/mapping-candidates-0005.json","run_id":"P1V0-RUN-0005","sha256":"909c6d472a0c903b1708e7553abd96e5e08ca53de12bfb520d0602b7f8d75483"},{"path":"research/scenarios/interp-dialogue-001/elicitation/p1/session-inputs/session-input-0006.json","run_id":"P1V0-RUN-0006","sha256":"d6fde997f3859030423fd12d7d03c2fa52cd12d82bc9a1305c9e8be51b793ed9"},{"path":"research/scenarios/interp-dialogue-001/elicitation/p1/runs/run-0006.json","run_id":"P1V0-RUN-0006","sha256":"d978c5dc41b7b447b64e810f6b3fe8215cb50bec9703c4fa8ea7ac60c402570d"},{"path":"research/scenarios/interp-dialogue-001/elicitation/p1/assessment/mechanical/mechanical-candidates-0006.json","run_id":"P1V0-RUN-0006","sha256":"423bb94f083abc3949eadeb0eef1e6558d2e13e7abc2ef5eb7b73298e44c87a5"},{"path":"research/scenarios/interp-dialogue-001/elicitation/p1/assessment/mapping/mapping-candidates-0006.json","run_id":"P1V0-RUN-0006","sha256":"0f3b462967d97313cb0e722f0e5490f9eb1acd931a7d81f5613baf4e70fee328"},{"path":"research/scenarios/interp-dialogue-001/elicitation/p1/session-inputs/session-input-0007.json","run_id":"P1V0-RUN-0007","sha256":"69122e6ce68977a07c921733c44d61ddc9a0c0549fe75ea03bbaffc2f64d99f8"},{"path":"research/scenarios/interp-dialogue-001/elicitation/p1/runs/run-0007.json","run_id":"P1V0-RUN-0007","sha256":"8cc0530081ac7eb0d4398a69c9deeb93dd2ee40edd271239bdab7455d710c52a"},{"path":"research/scenarios/interp-dialogue-001/elicitation/p1/assessment/mechanical/mechanical-candidates-0007.json","run_id":"P1V0-RUN-0007","sha256":"16fcb021fa7453a635e3eaabbd21cab86ba37befb925ec1089487948dac9ec93"},{"path":"research/scenarios/interp-dialogue-001/elicitation/p1/assessment/mapping/mapping-candidates-0007.json","run_id":"P1V0-RUN-0007","sha256":"94dfadbb9fb5019b19c06e5a05191407e896c54ce1b547d5625a3298573be726"},{"path":"research/scenarios/interp-dialogue-001/elicitation/p1/session-inputs/session-input-0008.json","run_id":"P1V0-RUN-0008","sha256":"51d27d0fd4202cb487242719aa4f36596903949599ee8886202f5ea30323e669"},{"path":"research/scenarios/interp-dialogue-001/elicitation/p1/runs/run-0008.json","run_id":"P1V0-RUN-0008","sha256":"13c07ecf89e8b96aeaf7a4b9fd52960c6e00603318a4c193edfa91ad8ebf88e6"},{"path":"research/scenarios/interp-dialogue-001/elicitation/p1/assessment/mechanical/mechanical-candidates-0008.json","run_id":"P1V0-RUN-0008","sha256":"ecc0e72d552bce4abaec0a9e49bfe5be39c3880f36512a0b7bab3f4af2f61f4e"},{"path":"research/scenarios/interp-dialogue-001/elicitation/p1/assessment/mapping/mapping-candidates-0008.json","run_id":"P1V0-RUN-0008","sha256":"62733b30c810f0a71a31f5889dae5c2c7ba771a6e4fcf776c3eb2a228680dcd0"},{"path":"research/scenarios/interp-dialogue-001/elicitation/p1/session-inputs/session-input-0009.json","run_id":"P1V0-RUN-0009","sha256":"de26c0a4aac228346703767059da1920d0c82775f8e8e45aeb279fc55a5ef4e3"},{"path":"research/scenarios/interp-dialogue-001/elicitation/p1/runs/run-0009.json","run_id":"P1V0-RUN-0009","sha256":"39775e17d4cde27f64adc5e10b4783112f3164675e457fe6bc765ab48ce0db57"},{"path":"research/scenarios/interp-dialogue-001/elicitation/p1/assessment/mechanical/mechanical-candidates-0009.json","run_id":"P1V0-RUN-0009","sha256":"c89b6f02ba4e734804dbadace81c7f6dea83847fa75bfcda9871aaa5f9965bac"},{"path":"research/scenarios/interp-dialogue-001/elicitation/p1/assessment/mapping/mapping-candidates-0009.json","run_id":"P1V0-RUN-0009","sha256":"365c535fb5f1ea90ffd3c76014d1d9eec093e111a23e6993ac1dd7fc24d2997f"},{"path":"research/scenarios/interp-dialogue-001/elicitation/p1/session-inputs/session-input-0010.json","run_id":"P1V0-RUN-0010","sha256":"806297e206a38e0770af0195234887070b81eefc945362000e617a91eda6dc76"},{"path":"research/scenarios/interp-dialogue-001/elicitation/p1/runs/run-0010.json","run_id":"P1V0-RUN-0010","sha256":"a57cede7497921366516562a20ca56f0694d0acded4e41136810d78614fd2ae3"},{"path":"research/scenarios/interp-dialogue-001/elicitation/p1/assessment/mechanical/mechanical-candidates-0010.json","run_id":"P1V0-RUN-0010","sha256":"8fedf3686edfa1239efb56746f61370769a299cc6cc9169dae5a60c73a9b57b6"},{"path":"research/scenarios/interp-dialogue-001/elicitation/p1/assessment/mapping/mapping-candidates-0010.json","run_id":"P1V0-RUN-0010","sha256":"6b9183d462fae03151a4c967f3592a8bef33b098b62f4a15a52777c32188d96d"},{"path":"research/scenarios/interp-dialogue-001/elicitation/p1/session-inputs/session-input-0011.json","run_id":"P1V0-RUN-0011","sha256":"f656cb9c6aeb7611107e014795fee4340ab83d912b3759c2854209fe522530b5"},{"path":"research/scenarios/interp-dialogue-001/elicitation/p1/runs/run-0011.json","run_id":"P1V0-RUN-0011","sha256":"3decf0e7f85f7f861144e3084cd8282457ea5987abac1532309ff1b611d6a140"},{"path":"research/scenarios/interp-dialogue-001/elicitation/p1/assessment/mechanical/mechanical-candidates-0011.json","run_id":"P1V0-RUN-0011","sha256":"f4cb45fdb80963c613f0935af6c642de9fcfe202077549f2e80a8a6f44b0d1fd"},{"path":"research/scenarios/interp-dialogue-001/elicitation/p1/assessment/mapping/mapping-candidates-0011.json","run_id":"P1V0-RUN-0011","sha256":"c029ed359b0053e28f5f6a6980074a4c3c609b5fbb8c1c61d08c1372f2edac97"},{"path":"research/scenarios/interp-dialogue-001/elicitation/p1/session-inputs/session-input-0012.json","run_id":"P1V0-RUN-0012","sha256":"f90c3f5863f2f9d3575c8982e4d910dcaa0c4d3f843f07bc547cee1a7a37dbd7"},{"path":"research/scenarios/interp-dialogue-001/elicitation/p1/runs/run-0012.json","run_id":"P1V0-RUN-0012","sha256":"2c2b6a99014a094328fcfb7f0322ade1582850077ac67f8a2a4b80020d8d986f"},{"path":"research/scenarios/interp-dialogue-001/elicitation/p1/assessment/mechanical/mechanical-candidates-0012.json","run_id":"P1V0-RUN-0012","sha256":"81036da038effd81309b5e24696af86a1a6b6e7fbee517782481974a5b326ca1"},{"path":"research/scenarios/interp-dialogue-001/elicitation/p1/assessment/mapping/mapping-candidates-0012.json","run_id":"P1V0-RUN-0012","sha256":"b22e8e4f3e0795efc7e19c46aa59bdc88dbd9ed321101b3ed183e56334ee9669"